contract_id,summary,termination_clause,confidentiality_clause,liability_clause
ENTRUSTINC_07_24_1998-EX-10.5-STRATEGIC ALLIANCE AGREEMENT,"This Strategic Alliance Agreement lets Northern Telecom (NTL) and Entrust Technologies (ETI) share and cross‑license each other's patents and technology. NTL receives a perpetual, worldwide right to use Entrust products and may contract for support services, paying $300,000 in 1997. ETI must grant NTL access to source code, enter reseller and source‑code license agreements, and pay fees tied to NTL's use of the technology. Both parties give each other royalty‑free patent licenses for products and services in their fields. Risks include a capped liability of $1 million for IP indemnity, an early‑termination clause that can end the reseller deal if ETI defaults or ceases to be NTL’s subsidiary, and no explicit confidentiality provisions in the excerpt.","Subject to early termination for material default, such Reseller Agreement shall expire either in three years or when ETI ceases to be a Subsidiary of NTL, whichever event occurs later.",NOT FOUND,"ETI's liability to Nortel arising from or relating to the intellectual property indemnity set forth in the Enterprise License shall not exceed 50% (fifty percent) of the monies paid by Nortel thereunder to a maximum of U.S.$1,000,000 (one million U.S. dollars)."
MACROGENICSINC_08_02_2013-EX-10-COLLABORATION AGREEMENT,"This Collaboration Agreement sets out a partnership between MacroGenics and Green Cross to develop and, if approved, commercialize MacroGenics' anti‑HER2 antibody MGAH22 in South Korea. MacroGenics will grant Green Cross an exclusive license for all indications and pharmaceutical forms of the antibody in that territory, while Green Cross will fund development activities, obtain regulatory approvals, and handle commercialization, including sales, marketing, and post‑approval activities. Both parties must comply with applicable laws, good manufacturing and clinical practices, and share confidential information. Key risks include failure to secure regulatory approval, non‑compliance with cGMP/GCP standards, and potential loss of exclusivity if milestones are not met. The agreement also outlines cost allocations, such as commercial supply costs and fully‑burdened manufacturing costs, which could affect each party’s financial exposure.",NOT FOUND,NOT FOUND,NOT FOUND
"VAPOTHERM, INC. - Manufacturing and Supply Agreement","This Manufacturing and Supply Agreement sets out a relationship where Vapotherm, a U.S. medical device maker, contracts Medica in Italy to produce specialized cartridges for its humidified gas therapy system. Vapotherm must give Medica regular forecasts and place purchase orders that meet minimum percentages of those forecasts, while Medica must keep a safety stock, meet strict quality specifications, and deliver on time. If deliveries are late or cartridges fail to meet specifications, Vapotherm can receive price reductions, demand replacements, or cancel orders. Payments are due within a set number of days, with interest penalties for late payment. The agreement also includes provisions for quality monitoring, inspections, recalls, and indemnification, but the excerpt does not contain the detailed termination, confidentiality, or liability language.",NOT FOUND,NOT FOUND,NOT FOUND
SouthernStarEnergyInc_20051202_SB-2A_EX-9_801890_EX-9_Affiliate Agreement,"This agreement sets up an affiliate program where website owners (Affiliates) place links to software products on their sites. When a visitor clicks the link, purchases the software through element 5’s order system, the Affiliate earns a commission based on the sale price, up to 50% and subject to a minimum payout threshold. Affiliates must integrate the provided link correctly, keep their login credentials confidential, and display required disclosures about their partnership. element 5 handles order processing, payment collection, refunds, and passes the net proceeds (minus commission, service fees and taxes) to the Software Publisher. The Software Publisher configures commission rates and supplies advertising material, which the Affiliate may use but not alter without permission. Risks include loss of commission if links malfunction, delayed payments until the minimum threshold is met, and potential liability for incorrect pricing or content on the Affiliate’s site.",NOT FOUND,NOT FOUND,NOT FOUND
"HEMISPHERX - Sales, Marketing, Distribution, and Supply Agreement","This Sales, Marketing, Distribution and Supply Agreement lets Hemispherx, the drug owner, grant Scien an exclusive right to sell and distribute its Interferon alfa‑n3 in the GCC after a successful MERS trial. Hemispherx must supply the product at a discounted transfer price and provide scientific support; Scien must create a business plan, obtain regulatory approvals, manage logistics, hold inventory, and pay for all marketing activities, reporting quarterly sales to Hemispherx. The contract runs for three years with automatic two‑year extensions, but can be ended for breach—such as missing purchase targets, failure to distribute, or insolvency. Risks include strict purchase milestones, payment within 75 days, and potential termination if either party becomes bankrupt or cannot fulfill obligations.","VI. TERM/TERMINATION A. The Term will be 3 years from Effective Date with an automatic 2 year term extensions unless otherwise advised by one of the Parties. B. Termination for breach will include: 1. Failure to purchase Product and distribute to End Users as called for in II D. 2. Failure of SCIEN achieving less than 50% achievement of the minimum Purchases as in III B.7. for two (2) consecutive years, 3. Insolvency, or the filing for protection under either Party's bankruptcy laws. Upon the filing of a petition in bankruptcy, insolvency or reorganization against or by either Party, or either Party becoming subject to a composition for creditors , whether by law or agreement, or either party going into receivership or otherwise becomin",NOT FOUND,NOT FOUND
